,word,meaning,der
581,b'enlightening',"b'adj. \xea\xb3\x84\xeb\xaa\xbd\xec\xa0\x81\xec\x9d\xb8, \xea\xb9\xa8\xec\x9a\xb0\xec\xb9\x98\xeb\x8a\x94'",b'enlighten enlightens enlightening enlightened'
582,b'entry',b'n. \xec\x9e\x85\xec\x9e\xa5',b'entry entries entrying entried'
583,b'finance',b'n. \xec\x9e\x90\xea\xb8\x88 v. \xec\x9e\x90\xea\xb8\x88\xec\x9d\x84 \xeb\x8c\x80\xeb\x8b\xa4',b'finance finances financing financed'
584,b'foundation',b'n. \xec\x84\xa4\xeb\xa6\xbd; \xec\x9e\xac\xeb\x8b\xa8',b'foundation foundations foundationing foundationed'
585,b'fund',b'v. \xec\x9e\x90\xea\xb8\x88\xec\x9d\x84 \xeb\x8c\x80\xeb\x8b\xa4',b'fund funds funding funded'
586,b'funding',b'n. \xec\x9e\xac\xec\xa0\x95 \xec\xa7\x80\xec\x9b\x90',b'fund funds funding funded'
587,b'fundraising',b'n. \xea\xb8\xb0\xea\xb8\x88 \xeb\xaa\xa8\xea\xb8\x88',b'fundrais fundraiss fundraising fundraised'
588,b'generous',"b'adj. \xed\x9b\x84\xed\x95\x9c, \xeb\x84\x89\xeb\x84\x89\xed\x95\x9c'",b'generou generous generouing generoued'
589,b'generosity',b'n. \xeb\x84\x88\xea\xb7\xb8\xeb\x9f\xac\xec\x9b\x80',b'generosity generosities generositying generositied'
590,b'invite',b'v. \xec\xb4\x88\xeb\x8c\x80\xed\x95\x98\xeb\x8b\xa4',b'invite invites inviting invited'
591,b'local',b'adj. \xec\xa7\x80\xec\x97\xad\xec\x9d\x98 n. \xed\x98\x84\xec\xa7\x80\xec\x9d\xb8',b'local locals localling localled'
592,b'municipal',"b'adj. \xec\xa7\x80\xeb\xb0\xa9 \xec\x9e\x90\xec\xb9\x98\xec\xa0\x9c\xec\x9d\x98, \xec\x8b\x9c\xec\x9d\x98'",b'municipal municipals municipalling municipalled'
593,b'patron',"b'n. \xed\x9b\x84\xec\x9b\x90\xec\x9e\x90, \xea\xb3\xa0\xea\xb0\x9d'",b'patron patrons patronning patronned'
594,b'philanthropic',"b'adj. \xec\x9e\x90\xec\x84\xa0\xec\x9d\x98, \xec\x9d\xb8\xec\xa0\x95 \xeb\xa7\x8e\xec\x9d\x80'",b'philanthropic philanthropices philanthropicking philanthropicked'
595,b'pledge',"b'n. \xeb\xa7\xb9\xec\x84\xb8, \xec\x84\x9c\xec\x95\xbd v. \xeb\xa7\xb9\xec\x84\xb8[\xec\x84\x9c\xec\x95\xbd]\xed\x95\x98\xeb\x8b\xa4'",b'pledge pledges pledging pledged'
596,b'proceeds',b'n. \xec\x88\x98\xec\x9d\xb5\xea\xb8\x88',b'proceed proceeds proceeding proceeded'
597,b'public',"b'adj. \xea\xb3\xb5\xea\xb3\xb5\xec\x9d\x98 n. \xeb\x8c\x80\xec\xa4\x91, \xec\x9d\xbc\xeb\xb0\x98'",b'public publices publicking publicked'
598,b'revitalize',b'v. \xec\x9e\xac\xed\x99\x9c\xec\x84\xb1\xed\x99\x94\xec\x8b\x9c\xed\x82\xa4\xeb\x8b\xa4',b'revitalize revitalizes revitalizing revitalized'
599,b'sponsorship',"b'n. \xed\x9b\x84\xec\x9b\x90, \xed\x98\x91\xec\xb0\xac'",b'sponsorship sponsorships sponsorshipping sponsorshipped'
600,b'unprecedented',b'adj. \xec\xa0\x84\xeb\xa1\x80\xea\xb0\x80 \xec\x97\x86\xeb\x8a\x94',b'unprecedent unprecedents unprecedenting unprecedented'
601,b'volunteer',b'n. \xec\x9e\x90\xec\x9b\x90\xeb\xb4\x89\xec\x82\xac\xec\x9e\x90 v. \xec\x9e\x90\xec\x9b\x90\xed\x95\x98\xeb\x8b\xa4',b'volunteer volunteers volunteering volunteered'
